{
  "schema_version": "1.1",
  "topic": {
    "id": "muscles-abdomen-thorax",
    "system": "muscles",
    "title": {
      "mn": null,
      "la": null,
      "en": "Axial muscles of the abdominal wall, thorax, pelvic floor and perineum"
    }
  },
  "structures": [
    {
      "id": "muscles-of-abdomen",
      "system": "muscles",
      "kind": "muscle-group",
      "region": "abdomen",
      "ta2_id": 2356,
      "names": {
        "mn": null,
        "la": "Musculi abdominis",
        "en": "Muscles of the abdomen"
      },
      "name_status": {
        "mn": "missing",
        "la": "source",
        "en": "source"
      },
      "parent_id": null,
      "description_mn": "Хэвлийн урд ба хажуу хэсгийг бүрхэж, урд дунд шугамд нийлдэг дөрвөн хос булчин: m. obliquus externus abdominis, m. obliquus internus abdominis, m. transversus abdominis, m. rectus abdominis. Хэвлийн урд хана хэвлийн эрхтнүүдийг хамгаалж, нурууны баганыг хөдөлгөнө; хүснэгтэд хэвлийн арын ханын m. quadratus lumborum-ийг мөн оруулсан.",
      "details": null,
      "clinical_mn": null,
      "images": [
        {
          "file": "1112_Muscles_of_the_Abdomen.jpg",
          "source_id": "openstax-ap2e",
          "view": "anterior",
          "region_id": null,
          "figure_check": "visible"
        }
      ],
      "sources": [
        {
          "source_id": "openstax-ap2e",
          "locator": "Ch.11.4 Axial Muscles of the Abdominal Wall, and Thorax — Muscles of the Abdomen",
          "fields": [
            "names.en",
            "description_mn",
            "images"
          ]
        },
        {
          "source_id": "openstax-ap2e",
          "locator": "Ch.11.4 Axial Muscles of the Abdominal Wall, and Thorax — Muscles of the Abdomen (table)",
          "fields": [
            "description_mn"
          ]
        },
        {
          "source_id": "openstax-ap2e",
          "locator": "Ch.11.4 Axial Muscles of the Abdominal Wall, and Thorax — Chapter Review",
          "fields": [
            "description_mn"
          ]
        },
        {
          "source_id": "ta2",
          "locator": "TA2 2356",
          "fields": [
            "ta2_id",
            "names.la"
          ]
        }
      ],
      "missing_in_sources": [
        "names.mn",
        "clinical_mn"
      ],
      "review": {
        "verified": false,
        "verified_by": null,
        "verified_date": null,
        "notes": null
      }
    },
    {
      "id": "external-oblique",
      "system": "muscles",
      "kind": "muscle",
      "region": "abdomen",
      "ta2_id": 2364,
      "names": {
        "mn": null,
        "la": "Musculus obliquus externus abdominis",
        "en": "External oblique"
      },
      "name_status": {
        "mn": "missing",
        "la": "source",
        "en": "source"
      },
      "parent_id": "muscles-of-abdomen",
      "description_mn": "Хэвлийн урд-хажуу ханын гурван хавтгай булчингийн хамгийн өнгөц давхарга. Ширхгүүд нь доош, дотогш (дөрвөн хуруугаа өмдний халаасанд хийх чиглэлээр) явна.",
      "details": {
        "detail_type": "muscle",
        "origin_mn": "Хавирга 5–12; os ilium (хүснэгтэд m. obliquus externus ба internus abdominis-ийг нэг мөрөнд хамт өгсөн).",
        "insertion_mn": "Хавирга 7–10; linea alba; os ilium (хүснэгтэд m. obliquus internus abdominis-тэй хамт өгсөн).",
        "action_mn": "Бэлхүүсээр мушгих (нурууны баганын 'supination') ба хажуу тийш нугалах.",
        "innervation_mn": "Thoraco-abdominal nerves (T7-11) ба subcostal nerve (T12)",
        "blood_supply_mn": null,
        "origin_bone_ids": [
          "ribs",
          "ilium"
        ],
        "insertion_bone_ids": [
          "ribs",
          "ilium"
        ]
      },
      "clinical_mn": null,
      "images": [
        {
          "file": "1112_Muscles_of_the_Abdomen.jpg",
          "source_id": "openstax-ap2e",
          "view": "anterior",
          "region_id": null,
          "figure_check": "labeled"
        }
      ],
      "sources": [
        {
          "source_id": "openstax-ap2e",
          "locator": "Ch.11.4 Axial Muscles of the Abdominal Wall, and Thorax — Muscles of the Abdomen",
          "fields": [
            "names.en",
            "description_mn",
            "images"
          ]
        },
        {
          "source_id": "openstax-ap2e",
          "locator": "Ch.11.4 Axial Muscles of the Abdominal Wall, and Thorax — Muscles of the Abdomen (table)",
          "fields": [
            "details"
          ]
        },
        {
          "source_id": "ta2",
          "locator": "TA2 2364",
          "fields": [
            "ta2_id",
            "names.la"
          ]
        },
        {
          "source_id": "wikipedia-en",
          "locator": "Wikipedia: Abdominal external oblique muscle (infobox) — https://en.wikipedia.org/wiki/Abdominal_external_oblique_muscle",
          "fields": [
            "details.innervation_mn"
          ]
        }
      ],
      "missing_in_sources": [
        "names.mn",
        "details.blood_supply_mn",
        "clinical_mn"
      ],
      "review": {
        "verified": false,
        "verified_by": null,
        "verified_date": null,
        "notes": "Хүснэгтэд external ба internal oblique-ийн эхлэл/бэхлэл/үйлдэл нэг мөрөнд хамт өгөгдсөн тул хоёуланд ижил бичив. Эхлэл/бэхлэлийг эх хүснэгтээс яг хуулав; багш эх хүснэгтийн утгыг шалгана. [Wikipedia-тэй зөрүү — багш шалгана: Artery талбар infobox-д байхгүй тул blood_supply_mn бөглөөгүй. Existing insertion_mn-д 'хавирга 7–10' гэж байгаа нь Wikipedia-гийн insertion (xiphoid process, iliac crest, pubic crest/tubercle, linea alba, inguinal ligament, ASIS)-д байхгүй (хүснэгтэд internus-тай хамт өгсөнтэй холбоотой).]"
      }
    },
    {
      "id": "internal-oblique",
      "system": "muscles",
      "kind": "muscle",
      "region": "abdomen",
      "ta2_id": 2373,
      "names": {
        "mn": null,
        "la": "Musculus obliquus internus abdominis",
        "en": "Internal oblique"
      },
      "name_status": {
        "mn": "missing",
        "la": "source",
        "en": "source"
      },
      "parent_id": "muscles-of-abdomen",
      "description_mn": "Хэвлийн урд-хажуу ханын дунд давхаргын хавтгай булчин. Ширхгүүд нь m. obliquus externus abdominis-ийн ширхэгт перпендикуляр буюу дээш, дотогш (халаасанд гараа хийхэд эрхий хурууны чиглэлээр) явна.",
      "details": {
        "detail_type": "muscle",
        "origin_mn": "Хавирга 5–12; os ilium (хүснэгтэд m. obliquus externus ба internus abdominis-ийг нэг мөрөнд хамт өгсөн).",
        "insertion_mn": "Хавирга 7–10; linea alba; os ilium (хүснэгтэд m. obliquus externus abdominis-тэй хамт өгсөн).",
        "action_mn": "Бэлхүүсээр мушгих (нурууны баганын 'supination') ба хажуу тийш нугалах.",
        "innervation_mn": "Thoracoabdominal nn. (T7-T11), subcostal n. (T12), iliohypogastric n. (L1) ба ilioinguinal n. (L1)",
        "blood_supply_mn": "Subcostal arteries",
        "origin_bone_ids": [
          "ribs",
          "ilium"
        ],
        "insertion_bone_ids": [
          "ribs",
          "ilium"
        ]
      },
      "clinical_mn": null,
      "images": [
        {
          "file": "1112_Muscles_of_the_Abdomen.jpg",
          "source_id": "openstax-ap2e",
          "view": "anterior",
          "region_id": null,
          "figure_check": "labeled"
        }
      ],
      "sources": [
        {
          "source_id": "openstax-ap2e",
          "locator": "Ch.11.4 Axial Muscles of the Abdominal Wall, and Thorax — Muscles of the Abdomen",
          "fields": [
            "names.en",
            "description_mn",
            "images"
          ]
        },
        {
          "source_id": "openstax-ap2e",
          "locator": "Ch.11.4 Axial Muscles of the Abdominal Wall, and Thorax — Muscles of the Abdomen (table)",
          "fields": [
            "details"
          ]
        },
        {
          "source_id": "ta2",
          "locator": "TA2 2373",
          "fields": [
            "ta2_id",
            "names.la"
          ]
        },
        {
          "source_id": "wikipedia-en",
          "locator": "Wikipedia: Internal abdominal oblique muscle (infobox) — https://en.wikipedia.org/wiki/Abdominal_internal_oblique_muscle",
          "fields": [
            "details.innervation_mn",
            "details.blood_supply_mn"
          ]
        }
      ],
      "missing_in_sources": [
        "names.mn",
        "clinical_mn"
      ],
      "review": {
        "verified": false,
        "verified_by": null,
        "verified_date": null,
        "notes": "Хүснэгтэд external ба internal oblique-ийн эхлэл/бэхлэл/үйлдэл нэг мөрөнд хамт өгөгдсөн тул хоёуланд ижил бичив. Эхлэл/бэхлэлийг эх хүснэгтээс яг хуулав; багш эх хүснэгтийн утгыг шалгана. [Wikipedia-тэй зөрүү — багш шалгана: existing origin_mn 'Хавирга 5–12; os ilium' and insertion_mn 'Хавирга 7–10; linea alba; os ilium' (OpenStax combined external+internal oblique row) differ from Wikipedia: Origin 'Inguinal ligament, iliac crest and the lumbodorsal fascia'; Insertion 'Linea alba, pectineal line of pubis (via conjoint tendon) and ribs 10-12'. Not changed.]"
      }
    },
    {
      "id": "transversus-abdominis",
      "system": "muscles",
      "kind": "muscle",
      "region": "abdomen",
      "ta2_id": 2375,
      "names": {
        "mn": null,
        "la": "Musculus transversus abdominis",
        "en": "Transversus abdominis"
      },
      "name_status": {
        "mn": "missing",
        "la": "source",
        "en": "source"
      },
      "parent_id": "muscles-of-abdomen",
      "description_mn": "Хэвлийн урд-хажуу ханын хамгийн гүн давхарга. Ширхгүүд нь өмдний бүсний урд хэсэг шиг хэвлийг хөндлөн тойрон байрлана. Гурван давхарга булчин өөр өөр чиглэлтэй тул их биеийн олон төрлийн хөдөлгөөн, эргэлтийг хангаж, ясгүй хэсэгт хэвлийн эрхтнүүдийг хамгаална.",
      "details": {
        "detail_type": "muscle",
        "origin_mn": "Os ilium; хавирга 5–10.",